{
    "$schema": "http://json-schema.org/draft-07/schema#",
    "type": "object",
    "additionalProperties": false,
    "definitions": {
        "nativeErrorHandling": {
            "type": "object",
            "title": "Error handling strategy",
            "properties": {
                "onSubscribe": {
                    "$ref": "#/definitions/subscribeErrorHandling"
                },
                "onPublish": {
                    "$ref": "#/definitions/publishErrorHandling"
                }
            },
            "gioConfig": {
                "displayIf": {
                    "$eq": {
                        "context.apiType": ["NATIVE"]
                    }
                }
            }
        },
        "subscribeErrorHandling": {
            "type": "object",
            "title": "SubscribeErrorHandling",
            "description": "Error handling for subscribe phase",
            "oneOf": [
                {
                    "title": "Invalidate partition",
                    "properties": {
                        "strategy": {
                            "const": "INVALIDATE_PARTITION"
                        }
                    },
                    "required": ["strategy"]
                },
                {
                    "title": "Add record header",
                    "properties": {
                        "strategy": {
                            "const": "ADD_RECORD_HEADER"
                        },
                        "headerName": {
                            "title": "Record header name",
                            "description": "Record header name to append validation error",
                            "type": "string"
                        }
                    },
                    "required": ["strategy", "headerName"]
                }
            ],
            "gioConfig": {
                "displayIf": {
                    "$eq": {
                        "context.flowPhase": ["SUBSCRIBE"]
                    }
                }
            }
        },
        "publishErrorHandling": {
            "title": "PublishErrorHandling",
            "type": "object",
            "description": "Error handling for publish phase",
            "oneOf": [
                {
                    "title": "Fail with invalid record",
                    "properties": {
                        "strategy": {
                            "const": "FAIL_WITH_INVALID_RECORD"
                        }
                    },
                    "required": ["strategy"]
                }
            ],
            "gioConfig": {
                "displayIf": {
                    "$eq": {
                        "context.flowPhase": ["PUBLISH"]
                    }
                }
            }
        },
        "schemaSource": {
            "title": "SchemaSource",
            "type": "object",
            "description": "Schema source",
            "oneOf": [
                {
                    "title": "Static schema",
                    "properties": {
                        "sourceType": {
                            "const": "STATIC_SCHEMA"
                        },
                        "staticSchema": {
                            "title": "JSON Schema",
                            "description": "JSON Schema used for request payload validation",
                            "type": "string",
                            "format": "gio-code-editor",
                            "gioConfig": {
                                "monacoEditorConfig": {
                                    "language": "json"
                                }
                            }
                        }
                    },
                    "required": ["sourceType", "staticSchema"]
                },
                {
                    "title": "Schema registry",
                    "properties": {
                        "sourceType": {
                            "const": "SCHEMA_REGISTRY_RESOURCE"
                        },
                        "resourceName": {
                            "title": "Resource name",
                            "description": "Name of the schema registry resource",
                            "type": "string"
                        },
                        "schemaMapping": {
                            "title": "Schema mapping",
                            "description": "EL that evaluates to schema subject",
                            "type": "string"
                        }
                    },
                    "required": ["sourceType", "resourceName", "schemaMapping"]
                }
            ]
        }
    },
    "properties": {
        "scope": {
            "title": "Scope",
            "description": "Execute policy on <strong>request content</strong> or <strong>response content</strong> phase.",
            "type": "string",
            "default": "REQUEST_CONTENT",
            "enum": ["REQUEST_CONTENT", "RESPONSE_CONTENT"],
            "deprecated": true
        },
        "errorMessage": {
            "title": "Http error message",
            "description": "Http error message to send when request is not valid. Status code is 400 as Bad request for REQUEST scope. Status code is 500 as Internal Error for RESPONSE scope (without straight respond mode). e.g: {\"error\":\"Bad request\"}",
            "type": "string",
            "format": "gio-code-editor",
            "gioConfig": {
                "monacoEditorConfig": {
                    "language": "json"
                },
                "displayIf": {
                    "$eq": {
                        "context.apiType": ["MESSAGE", "PROXY"]
                    }
                }
            },
            "x-schema-form": {
                "type": "codemirror",
                "codemirrorOptions": {
                    "placeholder": "Put your error message here or drag'n'drop it",
                    "lineWrapping": true,
                    "lineNumbers": true,
                    "allowDropFileTypes": true,
                    "autoCloseTags": true,
                    "mode": "json",
                    "value": "{\"error\":\"Bad request\"}"
                },
                "expression-language": true
            }
        },
        "schema": {
            "title": "JSON Schema (legacy)",
            "description": "Legacy field. Gateways older than 4.12 read only this field and ignore Schema source. If some of your gateways are older than 4.12, fill it with the same schema as Schema source and keep the two identical: when both are filled, gateways and engines do not agree on which one wins. Otherwise leave it empty and use Schema source.",
            "type": "string",
            "x-schema-form": {
                "type": "codemirror",
                "codemirrorOptions": {
                    "placeholder": "Put your json schema here or drag'n'drop it",
                    "lineWrapping": true,
                    "lineNumbers": true,
                    "allowDropFileTypes": true,
                    "autoCloseTags": true,
                    "mode": "javascript"
                }
            },
            "format": "gio-code-editor",
            "gioConfig": {
                "monacoEditorConfig": {
                    "language": "json"
                }
            }
        },
        "schemaSource": {
            "$ref": "#/definitions/schemaSource",
            "x-schema-form": {
                "hidden": true
            }
        },
        "nativeErrorHandling": {
            "$ref": "#/definitions/nativeErrorHandling",
            "x-schema-form": {
                "hidden": true
            }
        },
        "validateUnchecked": {
            "title": "Validate unchecked",
            "description": "Unchecked validation means that conditions which would normally cause the processing to stop with an exception are instead inserted into the resulting report. Warning: this means that anomalous events like an unresolvable JSON Reference, or an invalid schema, are masked!",
            "type": "boolean"
        },
        "deepCheck": {
            "title": "Deep check",
            "description": "Instructs the validator as to whether it should validate children even if the container (array or object) fails to validate.",
            "type": "boolean"
        },
        "straightRespondMode": {
            "title": "Straight respond mode",
            "description": "Only for RESPONSE scope. When enabled, responses that fail validation are still forwarded to the client unchanged. Validation failures are recorded in the metrics for further inspection.",
            "type": "boolean"
        },
        "returnDetailedErrorReport": {
            "title": "Return detailed error report",
            "description": "Return per-field JSON Schema validation detail in the error response instead of the generic error message. Warning: exposes schema structure to callers — disable in production unless callers are trusted.",
            "type": "boolean",
            "default": false
        }
    }
}
